text,iso_code,language_name,source,usage
갈 때마다 버섯칼국수를 시켜 먹는데 첨엔 샤브샤브 식으로 버섯과 미나리를 건져 먹고 칼국수 면을 넣어서 먹어요,ko,Korean,Universal Dependencies Treebanks,preprocessing
이 때 함께 개방한 가맹사업 역시 마찬가지다.,ko,Korean,Universal Dependencies Treebanks,preprocessing
금선은 공지의 주장을 배신행위로 간주하여 모욕을 주고 방안에 가둔다.,ko,Korean,Universal Dependencies Treebanks,preprocessing
회도 양이 짱 많아서 넘넘 좋아요 ^0^,ko,Korean,Universal Dependencies Treebanks,preprocessing
리움 미술관은 어떻게 생겼냐,ko,Korean,Universal Dependencies Treebanks,preprocessing
아이 장갑 하나 사려고 리조트 내에 있는 상점에 갔는데 (스키용품 판매 가게는 하나뿐임) 사이즈 작아서 교환하러 갔더니 택 뜯어서 안된다네요,ko,Korean,Universal Dependencies Treebanks,preprocessing
"소설 속에서는 약한 입장인 여성도, 평화를 위해 남자들에게 정면으로 대하는 모습이 그려지고 있다.",ko,Korean,Universal Dependencies Treebanks,preprocessing
전 약간 비린 느낌이여서 좀 별로더라구요.,ko,Korean,Universal Dependencies Treebanks,preprocessing
굉장히 다운펌을 잘 해주었어요.,ko,Korean,Universal Dependencies Treebanks,preprocessing
시외버스 터미널 근처라 포항 시외버스 이용하시는 분이라면 꼭 한 번 가보라고 추천하고 싶은 곳!,ko,Korean,Universal Dependencies Treebanks,preprocessing
20일 그랜드성형외과 홈페이지를 통해 신이의 최근 모습이 공개됐다.,ko,Korean,Universal Dependencies Treebanks,preprocessing
소녀시대의 최근 뮤직 비데오를 찾아줘.,ko,Korean,Universal Dependencies Treebanks,preprocessing
자전거 타고 스타벅스 가려면,ko,Korean,Universal Dependencies Treebanks,preprocessing
무지하게 맵긴 한데 먹으면 먹을수록 땡기는 맛,ko,Korean,Universal Dependencies Treebanks,preprocessing
동네 분 추천으로 가게 되었는데 기대 이상이였어요.,ko,Korean,Universal Dependencies Treebanks,preprocessing
한국 여자골프군단이 유럽여자프로골프 ANZ 레이디스 마스터스 3라운드에서도 대거 상위권에 포진하며 우승 가능성을 높였다.,ko,Korean,Universal Dependencies Treebanks,preprocessing
일부에서는 원유 저장시설의 한계로 곧 재고량이 작년 수준으로 낮아질 것이라는 전망도 제기된다.,ko,Korean,Universal Dependencies Treebanks,preprocessing
이 건물은 기둥 위에만 공구를 배치한 주심포 양식으로 조선 후기에 유행하는 새 날개모양의 부재인 익공(翼工)을 설치하였다.,ko,Korean,Universal Dependencies Treebanks,preprocessing
1079년 세비야를 지배하던 무어인 왕에게 사절로 가 있던 그는 가르시아 오르도녜스와 불화를 일으키게 되었다.,ko,Korean,Universal Dependencies Treebanks,preprocessing
실제로 좌의정까지 오른 김안로는 무소불위의 권력을 휘두르며 정족을 제거하는 공포정치를 폈다.,ko,Korean,Universal Dependencies Treebanks,preprocessing
63빌딩 몇 미터야,ko,Korean,Universal Dependencies Treebanks,preprocessing
올 여름 최고의 기대작 <7광구 제작 비하인드 스토리를 담은 제작기 영상을 공개했다.,ko,Korean,Universal Dependencies Treebanks,preprocessing
1인분도 가능하며 여럿이 함께해도 개인별로 메뉴가 나와서 좋다,ko,Korean,Universal Dependencies Treebanks,preprocessing
크기 또한 왕입니다,ko,Korean,Universal Dependencies Treebanks,preprocessing
닭갈비는 맛나지만 양념이 쌔서 1인분 이상은 물리네요.,ko,Korean,Universal Dependencies Treebanks,preprocessing
고양이 간판에 넘 예뻐 기대 반 호기심 반으로 갔는데 넘 이뻐 돌아가시는 줄 알았슴,ko,Korean,Universal Dependencies Treebanks,preprocessing
양념만 주문하고 반반으로 해 달라고 하니까 안 된다고 하네요,ko,Korean,Universal Dependencies Treebanks,preprocessing
선생님들 너무 친절하시고 가격도 괜찮고 무척 맘에 듬!,ko,Korean,Universal Dependencies Treebanks,preprocessing
아주 조용하고 물 깨끗하고 도시를 벗어나 휴식하기엔 딱 좋은 곳!,ko,Korean,Universal Dependencies Treebanks,preprocessing
미국 조지워싱턴대학교 한국총동창회는 28일 총동창회장에 이희범 경총 회장(STX중공업 및 STX건설 회장 겸임)을 선출했다고 밝혔다.,ko,Korean,Universal Dependencies Treebanks,preprocessing
집까지 버스로 어떻게 가니,ko,Korean,Universal Dependencies Treebanks,preprocessing
"반면 인천이 7.89%로 가장 높았고, 서울(7.02 %), 광주(6.87%)가 순이다.",ko,Korean,Universal Dependencies Treebanks,preprocessing
2007년 2월 25일 발매.,ko,Korean,Universal Dependencies Treebanks,preprocessing
그러던 그는 고2 때 집으로부터 독립한 후 자취 생활을 하다가 귀국하였다.,ko,Korean,Universal Dependencies Treebanks,preprocessing
청정 개발 체제(淸淨開發體制) 사업은 전 세계적으로 심화되고 있는 지구 온난화 현상을 완화시키기 위하여 선진국과 개도국이 공동으로 추진하는 온실기체 감축사업이다.,ko,Korean,Universal Dependencies Treebanks,preprocessing
만리장성 길이 알려줘,ko,Korean,Universal Dependencies Treebanks,preprocessing
내 주변 지도를 좀 보여줄래,ko,Korean,Universal Dependencies Treebanks,preprocessing
"이날 팬들은 보쌈과 간식거리는 물론, 밤샘 촬영을 이어가고 있는 스태프들에게 유용할 드라마 타이틀을 넣은 타올을 제작하는 등 세심한 배려까지 엿보여 지친 촬영 현장에 활기를 불어 넣었다는 후문이다.",ko,Korean,Universal Dependencies Treebanks,preprocessing
반면 경쟁 무자헤딘 파벌을 이끌던 굴부딘 헤크마티아르는 내무장관 라즈 모하마드 파크틴과 국방장관 모하마드 아슬람 와탄자르 소장을 포함한 전 정권의 일부 파슈툰 강경파들의 지지를 받았다.,ko,Korean,Universal Dependencies Treebanks,preprocessing
"전라북도 무장에서 태어났으며, 《심청가》를 남다르게 잘하였다.",ko,Korean,Universal Dependencies Treebanks,preprocessing
일산은 마두동 백마삼환극동 중대형이 500만~1000만원 정도 내렸다.,ko,Korean,Universal Dependencies Treebanks,preprocessing
가격은 좀 비싸지만 가까워서 자주 이용합니다,ko,Korean,Universal Dependencies Treebanks,preprocessing
그러나 다음날인 6일 새벽에는 대전을 비롯한 충청지역에 비 내리는 곳이 많겠다.,ko,Korean,Universal Dependencies Treebanks,preprocessing
아빠 직장 가자,ko,Korean,Universal Dependencies Treebanks,preprocessing
삼성본사 스트리트뷰를 보여주세요,ko,Korean,Universal Dependencies Treebanks,preprocessing
"가족협의회 이정국 대표는 오늘 브리핑에서 ""탄약과 무기류 등이 아직 함미 내부에 남아 있어 안전문제가 우려된다""며 ""이 부분에 대한 제거만 끝나면 내일 낮이나 모레 낮에 가족들이 참관을 하기로 군 당국과 협의를 마쳤다""고 말했습니다.",ko,Korean,Universal Dependencies Treebanks,preprocessing
제일 가까운 편의점 알려줘,ko,Korean,Universal Dependencies Treebanks,preprocessing
"유충은 살아있거나 썩은 나무에 구멍을 뚫고, 그 굴 속에서 균류을 먹으며 산다.",ko,Korean,Universal Dependencies Treebanks,preprocessing
유모차 가지고 갔더니 홀대허더이다...,ko,Korean,Universal Dependencies Treebanks,preprocessing
"이 사건은 브리스틀 대학이 강력하게 부정하였고 2005년 8월, 대규모 표본조사결과 사립학교위원회는 브리스틀 대학이 특정학교 출신을 차별한다는 증거는 발견되지 않았다고 발표했다.",ko,Korean,Universal Dependencies Treebanks,preprocessing
국제교육수도회인 노트르담수녀회가 1940년에 설립한 박문여고는 2008년 3월 외국어고 등 특수목적고를 제외한 인문계 고교로는 처음으로 국제반(유학반)을 편성했다.,ko,Korean,Universal Dependencies Treebanks,preprocessing
"타비타스 시크릿에서 활동하던 롭 토머스, 브라이언 예일, 폴 도체트는 밴드가 해체된 후 카일 쿡, 애덤 게이너와 함께 매치박스 트웬티를 결성하였다.",ko,Korean,Universal Dependencies Treebanks,preprocessing
1960년대 우리나라 방방곡곡에 붙어 있던 산아 제한 표어다.,ko,Korean,Universal Dependencies Treebanks,preprocessing
작전 과정 중에 해적이 발사한 총탄에 부상을 입은 삼호 주얼리호의 석해균 선장은 응급 처치 후 오만의 제2도시 살랄라에 위치한 술탄카부스 병원에서 수술을 받았다.,ko,Korean,Universal Dependencies Treebanks,preprocessing
주유소는 다 똑같은 줄 알았는데 sk직영이라 믿음도 가고 직원 분들도 깔끔하고 친절해서 좋았습니다.,ko,Korean,Universal Dependencies Treebanks,preprocessing
파닭이 정말 맛있어요,ko,Korean,Universal Dependencies Treebanks,preprocessing
길 막혀?,ko,Korean,Universal Dependencies Treebanks,preprocessing
"검찰은 이를 토대로 이씨를 집중 추궁했고, 결국 이씨는 ""A씨와 성관계를 전제로 만났는데 뚱뚱하다는 이유로 무시해 앙심을 품고 고소하게 됐다""는 자백을 받아냈다.",ko,Korean,Universal Dependencies Treebanks,preprocessing
사람들에 떠밀려 다니다가 사는 곳이죠,ko,Korean,Universal Dependencies Treebanks,preprocessing
지도교수는 박사과정을 밟을 것을 권유했다.,ko,Korean,Universal Dependencies Treebanks,preprocessing
"결혼에 대해서 묻자 ""안 했는지 못 했는지 모르겠다""며 웃었다.",ko,Korean,Universal Dependencies Treebanks,preprocessing
시설물은 좀 오래되었습니다.,ko,Korean,Universal Dependencies Treebanks,preprocessing
메뉴가 딱 세 가지인데 맛도 좋고 작지만 뜨끈한 방도 좋아요.,ko,Korean,Universal Dependencies Treebanks,preprocessing
"이 지역 점주들은 ""7~8월 비수기 저조한 매출을 대비하기 위해 5월 매출 신장을 위해 노력 중""이라고 전했다.",ko,Korean,Universal Dependencies Treebanks,preprocessing
"기원전 8세기에서 기원전 6세기에 이르는 기간 동안 아테네는 정치, 경제, 사회, 문화면에서 큰 변화를 겪었다.",ko,Korean,Universal Dependencies Treebanks,preprocessing
절지동물과 연체동물문(門)은 둘 다 외골격 생물이다.,ko,Korean,Universal Dependencies Treebanks,preprocessing
그는 이 결과를 은하는 하나뿐이라는 주장을 한 섀플리에게 편지로 부쳤다.,ko,Korean,Universal Dependencies Treebanks,preprocessing
에디슨은 누구,ko,Korean,Universal Dependencies Treebanks,preprocessing
"윤은혜는 ""기부금이 전달될 소녀들이 세상에는 이렇게 따뜻한 사람들이 많다는 걸 알고 더 큰 희망을 가졌으면 하는 바람이다""고 말했고, f(x) 설리는 ""아이티 참사를 계기로 젊은 세대들이 기부에 대해 좀 더 많은 관심을 갖게 된 것 같다.""고 말했다.",ko,Korean,Universal Dependencies Treebanks,preprocessing
쉬는 장소가 중사 휴게실입니다.,ko,Korean,Universal Dependencies Treebanks,preprocessing
지금 강남사거리 막혀,ko,Korean,Universal Dependencies Treebanks,preprocessing
이마트 폐점시간이 언제지,ko,Korean,Universal Dependencies Treebanks,preprocessing
서울 시내 차 가지고 나가도 되겠니,ko,Korean,Universal Dependencies Treebanks,preprocessing
일련의 사태의 최대 피해자는 SC제일은행 스스로다.,ko,Korean,Universal Dependencies Treebanks,preprocessing
음식이 깔큼하고 맛도 좋았어요.,ko,Korean,Universal Dependencies Treebanks,preprocessing
덕분에 휴일 기분 더럽습니다.,ko,Korean,Universal Dependencies Treebanks,preprocessing
우리 신랑과 남동생이 너무 조아라 하는 곳~,ko,Korean,Universal Dependencies Treebanks,preprocessing
석양 이미지를 찾으시오,ko,Korean,Universal Dependencies Treebanks,preprocessing
"한편, 아스널 입단 이후 한 번의 프리미어 리그 경기에도 출전하지 못한 박주영은 1월에 출전 기회를 노리고 있었지만, 앙리라는 의외의 경쟁자가 나타나면서 더욱 분발이 필요해졌다.",ko,Korean,Universal Dependencies Treebanks,preprocessing
탕수육은 절대 먹지 맙시다,ko,Korean,Universal Dependencies Treebanks,preprocessing
근처 주차장 어디야,ko,Korean,Universal Dependencies Treebanks,preprocessing
평수도 넓고 화장실 시설도 좋아요,ko,Korean,Universal Dependencies Treebanks,preprocessing
제일 가까운 병원까지 가는 데 걸리는 시간 좀 알려줘,ko,Korean,Universal Dependencies Treebanks,preprocessing
매콤한 맛이 일품인 맛집입니다,ko,Korean,Universal Dependencies Treebanks,preprocessing
"사생대회 수상자는 대구광역시교육감상 3명, 포항•구미교육장상 6명을 비롯해 대구은행장상 1,644명으로 수상자에게는 장학금 및 부상이 각각 주어졌다.",ko,Korean,Universal Dependencies Treebanks,preprocessing
신세계 백화점 어디 있냐,ko,Korean,Universal Dependencies Treebanks,preprocessing
"1886년에는 럭비 규칙을 제정하고 국제적인 럭비 행정을 총괄하는 기구로 국제 럭비 평의회(IRB, International Rugby Board)가 창설되었고, 1890년 럭비 유니온이 그를 승인하게 된다.",ko,Korean,Universal Dependencies Treebanks,preprocessing
먹어본 중 최고!,ko,Korean,Universal Dependencies Treebanks,preprocessing
부유세 이른바 버핏세가 정가의 화두가 됐습니다.,ko,Korean,Universal Dependencies Treebanks,preprocessing
그렇다면 심증적으로 요미우리가 없는 얘기를 지어내서 했겠느냐는 점에 많은 사람들이 귀를 기울이고 있다는 점을 똑바로 봐야 할 것이다.,ko,Korean,Universal Dependencies Treebanks,preprocessing
"거기에다 장미 혁명, 오렌지 혁명 이후 서방 세계와 더 밀접한 관계를 맺었기 때문에, 러시아와의 관계는 급속도로 냉각되었다.",ko,Korean,Universal Dependencies Treebanks,preprocessing
"생물 군계(生物群系) 또는 바이옴(biome)은 기후적, 또는 지리적으로 지구상에서 유사한 기후적 환경에 있는 식물 군집이나 동물 군집 그리고 토양 유기체로 정의되며, 종종 생태계로 언급되기도 한다.",ko,Korean,Universal Dependencies Treebanks,preprocessing
한강이 뭐지,ko,Korean,Universal Dependencies Treebanks,preprocessing
"2008년 10월에 제네시스 쿠페가 출시되어 단종되었으나, 후속 차종이 아닌 투스카니보다 한 등급 높은 차종이다.",ko,Korean,Universal Dependencies Treebanks,preprocessing
에이쇼 17년 (1520년) 오이 가문을 압박해 오이 노무다쓰(大井信達)의 딸을 아내로 맞이해 혼인동맹을 맺는다.,ko,Korean,Universal Dependencies Treebanks,preprocessing
체인점인데 직접 동태 사서 작업하신다네요,ko,Korean,Universal Dependencies Treebanks,preprocessing
겨울에는 무조건 내복 입고 주무세요.,ko,Korean,Universal Dependencies Treebanks,preprocessing
시의 동쪽 외곽에 있으며 붉은 성이라는 이름은 성의 거대한 벽이 붉은 빛을 띠고 있어서이다.,ko,Korean,Universal Dependencies Treebanks,preprocessing
장사 속은 찾아볼 수가 없어요,ko,Korean,Universal Dependencies Treebanks,preprocessing
요즘은 예전보단 덜 맛있는 거 같지만 여전히 굿,ko,Korean,Universal Dependencies Treebanks,preprocessing
대륙 개수 알려줘,ko,Korean,Universal Dependencies Treebanks,preprocessing
"제약사 가운데선 와이어스의 사이트에 6.3%가 방문해 가장 많았고, 제약 지원 부문에서는 닥터디렉토리(DoctorDirectory)가 22%를 끌어 가장 인기가 높았다.",ko,Korean,Universal Dependencies Treebanks,preprocessing
반찬이 웰빙이네요,ko,Korean,Universal Dependencies Treebanks,preprocessing
볶음 우동은 복불복인데 맛있는 날은 매콤하니 진짜 맛있음.,ko,Korean,Universal Dependencies Treebanks,preprocessing
"민왕 때 송(宋)을 멸망시키고, 연(燕)의 종묘사직을 쑥대밭으로 만들었는데, 이후 연(燕)의 명장 악의(樂毅)의 주도하에 제국연합의 책모가 있었다.",ko,Korean,Universal Dependencies Treebanks,preprocessing
한 이십 년 된 시설에 초저녁에 사람들 씻으면 위층은 물 안 나와 못 씻음,ko,Korean,Universal Dependencies Treebanks,preprocessing
일등 고기에 값은 저렴하고 깔끔하고 맛있고 친절했습니다.,ko,Korean,Universal Dependencies Treebanks,preprocessing
맥도날드까지 거리 좀 알려줘 마일 단위로,ko,Korean,Universal Dependencies Treebanks,preprocessing
전시는 물론 편의시설도 좋고 야외 공간도 제법 만족스럽네요,ko,Korean,Universal Dependencies Treebanks,preprocessing
"13-23장은 이방 민족들에 대한 심판 선언을 담고 있는데, 부분적으로만 이사야와 관련시킬 수 있다.",ko,Korean,Universal Dependencies Treebanks,preprocessing
또 제주지법 민사과에 선거효력정지 및 직무집행정지에 대한 가처분 신청을 할 계획이다.,ko,Korean,Universal Dependencies Treebanks,preprocessing
"내일 아침, 영상의 기온을 보이는 곳이 많겠습니다.",ko,Korean,Universal Dependencies Treebanks,preprocessing
기차타고 대전역으로 어떻게 가지?,ko,Korean,Universal Dependencies Treebanks,preprocessing
"반면 이정수의 아버지 이도원씨는 ""선발전 당시 정수가 삐끗하기는 했지만 경기 도중 누가 엉덩이에 손을 댔는지 알 수 없는 상황이었다""며 ""그 동영상으로 도움받았다고 판정하는 것은 수긍할 수 없다""고 말했다.",ko,Korean,Universal Dependencies Treebanks,preprocessing
"주로 포장을 해 가는데 양도 충분히 많고, 깔끔해서 괜찮습니다",ko,Korean,Universal Dependencies Treebanks,preprocessing
너무 야멸차게 안된다그래서 매번 무안합니다.,ko,Korean,Universal Dependencies Treebanks,preprocessing
기싸움에서 이기기 위해 건방지게 보이려 한다는 것이죠.,ko,Korean,Universal Dependencies Treebanks,preprocessing
"순간 열기 1,000도의 짚불에서 삼겹살을 초벌구이 하므로 육즙이 그대로 살아있고, 짚불의 향기가 돼지의 냄새를 잡아준다고 합니다.",ko,Korean,Universal Dependencies Treebanks,preprocessing
퀄리티 좋고 종류도 많아서 선택의 폭도 높아요,ko,Korean,Universal Dependencies Treebanks,preprocessing
람보르기니 무르시엘 사진,ko,Korean,Universal Dependencies Treebanks,preprocessing
"행안부 관계자는 ""6.2 지방선거 이후에도 깨끗한 공직풍토가 시작 단계부터 안정적으로 뿌리내릴 수 있도록 강도 높은 감찰활동을 계속 실시하겠다""고 전했다.",ko,Korean,Universal Dependencies Treebanks,preprocessing
둘이 주막에 들렀을 때 마침 백화(白花)라는 작부가 도망쳤다고 주모가 말하면서 붙잡아 달라는 부탁을 받는다.,ko,Korean,Universal Dependencies Treebanks,preprocessing
재미있는 강아지 동영상 좀 보여줘,ko,Korean,Universal Dependencies Treebanks,preprocessing
담백한 오리탕이 드시고픈 분께 추천...,ko,Korean,Universal Dependencies Treebanks,preprocessing
대전역까지 지하철로 갈 수 있니,ko,Korean,Universal Dependencies Treebanks,preprocessing
"1997년에 폰크의 후임으로 세묜 비슈코프가 상임 지휘자에 취임해 현재까지 재임 중이며, 비슈코프도 브람스의 교향곡 전집과 말러, 쇼스타코비치의 교향곡, 리하르트 슈트라우스의 오페라 전곡들을 비롯한 음반들을 출반하고 있다.",ko,Korean,Universal Dependencies Treebanks,preprocessing
짜장면은 맛있게 먹었는데 늘 탕수육이 그저 그래요,ko,Korean,Universal Dependencies Treebanks,preprocessing
"라틴 통화 동맹 (LMU, Latin Monetary Union)은 19세기 유럽의 여러 통화를 단일 통화로 추진하려는 기구였다.",ko,Korean,Universal Dependencies Treebanks,preprocessing
2차 발효 역시 반죽이 두 배로 부풀 정도로 실온에 그냥 비닐 덮어 두시면 됩니다.,ko,Korean,Universal Dependencies Treebanks,preprocessing
3월 12일 미야기 현에서 지진해일로 떠내려간 81명이 탄 선박을 자위대 소속 헬기가 발견하여 구조하기도 하였다.,ko,Korean,Universal Dependencies Treebanks,preprocessing
"영국의 최고 명문사학인 '옥스포드'에서는 우리 언어인 '한글'을 세계 최고의 과학적인 언어라고 인정하고 극찬한 이후, 세계는 우리의 언어에 주목하고 우리는 한글과 더불어 세계에 나아갑니다.",ko,Korean,Universal Dependencies Treebanks,preprocessing
"한편, 박복단 노인은 2010년 12월 30일 향년 94세의 나이로 사망했다.",ko,Korean,Universal Dependencies Treebanks,preprocessing
강아지 이미지 찾기,ko,Korean,Universal Dependencies Treebanks,preprocessing
2005년 케널 클럽(KC)과 세계애견연맹(FCI)에 정식 품종으로 등록됐다.,ko,Korean,Universal Dependencies Treebanks,preprocessing
주문할 때 정신 똑바로 차리세요,ko,Korean,Universal Dependencies Treebanks,preprocessing
말년에는 가장 아끼는 아들인 피의 도끼의 에이리크(Eirik Blodøks)에게 왕위를 물려줄 생각으로 통치권을 넘겨준 뒤 930년 삶을 마쳤다.,ko,Korean,Universal Dependencies Treebanks,preprocessing
몸집이 커다란 나무꾼으로 원래 신문 연재기사에서 비롯되었다.,ko,Korean,Universal Dependencies Treebanks,preprocessing
가까운 밥집 찾아주세요,ko,Korean,Universal Dependencies Treebanks,preprocessing
원래 ``외환보유고''는 금으로만 구성되어 있었다.,ko,Korean,Universal Dependencies Treebanks,preprocessing
이렇게 큰 힘이 기준 단위가 된 것은 전기에 대한 상세한 지식이 없는 시절에 이를 측정 단위로 삼았기 때문이다.,ko,Korean,Universal Dependencies Treebanks,preprocessing
3D 콘텐츠를 화면 깜빡거림과 화면 겹침 현상이 없이 편안하게 즐길 수 있다.,ko,Korean,Universal Dependencies Treebanks,preprocessing
당사자인 서울시는 난감한 처지다.,ko,Korean,Universal Dependencies Treebanks,preprocessing
"1층에 있는 가족룸과 2층을 사용했는데, 2층이 훨씬 예쁘고 깨끗하게 잘 되어 있네요.",ko,Korean,Universal Dependencies Treebanks,preprocessing
"마을 앞 하천이 반대 방향으로 흐르고, 그 위에 배가 떠 있는 형국으로 마을 가운데 있는 500년된 은행나무가 배의 돛대 역할을 한다는 뜻으로 지어졌다.",ko,Korean,Universal Dependencies Treebanks,preprocessing
특히 남자들 술 먹으면 술병 숫자가 실제 먹은 것보다 올라갑니다.,ko,Korean,Universal Dependencies Treebanks,preprocessing
연락 준다더니 전화할 때까지 절대 연락 안 줌;,ko,Korean,Universal Dependencies Treebanks,preprocessing
이에 마음이 움직인 포모나는 본래의 모습으로 돌아온 베르툼누스에게 몸을 맡겼다고 전한다.,ko,Korean,Universal Dependencies Treebanks,preprocessing
인류는 호모 하빌리스와 같은 초기의 인류에서 점차 진화를 하였다.,ko,Korean,Universal Dependencies Treebanks,preprocessing
최근에 바로 옆에 주차 시설이 생겨서 주차하기도 용이합니다.,ko,Korean,Universal Dependencies Treebanks,preprocessing
"이 별자리에서 가장 밝은 별의 겉보기 등급이 4.25등성인데, 이는 현대 88 별자리의 가장 밝은 별들 중 가장 어두운 것이다.",ko,Korean,Universal Dependencies Treebanks,preprocessing
LG전자는 최근 태국 공중파 TV방송인 채널9와 함께 차세대 가수 선발 리얼리티 프로그램인 'LG 엔터테이너'를 후원했다고 1일 밝혔다.,ko,Korean,Universal Dependencies Treebanks,preprocessing
"같은 기간 매출액은 2조2249억3900만원, 당기순이익은 1302억4500만원으로 각각 67.9 %, 43.4% 늘어났다.",ko,Korean,Universal Dependencies Treebanks,preprocessing
2008년 서울시청 광장에서 5만 8천 포기의 김장을 담가 한국 기네스 기록(한 장소에서 가장 많은 인원이 담근 김장의 양)을 세웠다.,ko,Korean,Universal Dependencies Treebanks,preprocessing
아랍에미리트연합(UAE)에 가서 원전수주에 성공한 직후인 올초 지지율(51.9%)에 육박하는 취임 후 최고수준이다.,ko,Korean,Universal Dependencies Treebanks,preprocessing
최홍만 얼마나 크냐,ko,Korean,Universal Dependencies Treebanks,preprocessing
사실 때 꼼꼼히 확인하시고 구입해야겠네요.,ko,Korean,Universal Dependencies Treebanks,preprocessing
지금 강남대로 상황은,ko,Korean,Universal Dependencies Treebanks,preprocessing
집까지 걸어서 가려면,ko,Korean,Universal Dependencies Treebanks,preprocessing
짱뚱어탕이 담백하고 묵은지와 양파김치가 맛있네요.,ko,Korean,Universal Dependencies Treebanks,preprocessing
자주 애용할 꺼에요,ko,Korean,Universal Dependencies Treebanks,preprocessing
수원에 ATM 보여줘,ko,Korean,Universal Dependencies Treebanks,preprocessing
이로써 길 목사는 지난 3월 28일 대표회장 직무집행 정지 결정 이후 5개월 만에 복귀하게 됐다.,ko,Korean,Universal Dependencies Treebanks,preprocessing
