text,iso_code,language_name,source,usage
最熱的地區是科尼亞盆地和馬拉蒂亞盆地，年降雨量常常少於300毫米。,zh,Chinese,Universal Dependencies Treebanks,preprocessing
安陽縣是中國河南省安陽市下轄的一個縣，位於河南省北緣，安陽市北部。,zh,Chinese,Universal Dependencies Treebanks,preprocessing
她其後更與Elite簽約。,zh,Chinese,Universal Dependencies Treebanks,preprocessing
塔內每層都有一道寬6尺寬的走廊，遊客可到走廊欣賞安順市的景色。,zh,Chinese,Universal Dependencies Treebanks,preprocessing
由於宋軍人數太少，劉平、石元孫被俘。,zh,Chinese,Universal Dependencies Treebanks,preprocessing
1952年12月美國總統艾森豪威爾訪問韓國，他擔任檢閱主管。,zh,Chinese,Universal Dependencies Treebanks,preprocessing
1960年3·15選舉舞弊引發群眾抗議示威，學生示威擴大為4·19學運，他任戒嚴司令官，1960年5月辭去陸軍參謀長職務，並在美國留學1年，1961年5月在華盛頓DC訪問時得知5.16軍事政變的消息。,zh,Chinese,Universal Dependencies Treebanks,preprocessing
抗戰勝利後，兼辦《天行報》、《原子能》雜誌。,zh,Chinese,Universal Dependencies Treebanks,preprocessing
神學是自覺宗教與自發宗教的最大分別，因為神學有其理論化及系統化，而自發宗教是不具神學體系的。,zh,Chinese,Universal Dependencies Treebanks,preprocessing
這種信仰被視為萬物的起源和歸宿，一切存在的根基及依據。,zh,Chinese,Universal Dependencies Treebanks,preprocessing
不料明軍艦隊挺進江面後，以大斧斫斷大鐵索，逆流而上。,zh,Chinese,Universal Dependencies Treebanks,preprocessing
英語中定語從句中甚至還可能包含定語從句，即多重定語從句。,zh,Chinese,Universal Dependencies Treebanks,preprocessing
就像所有的大賣場一樣，宜家家居吸引的消費者來自於範圍非常廣大的地區。,zh,Chinese,Universal Dependencies Treebanks,preprocessing
這樣的結果是可以生產出具有高度適應力的傢具，無論是大型房屋還是為數越來越眾多卻受到忽略的小型寓所，這些傢具都能夠改變大小來容納。,zh,Chinese,Universal Dependencies Treebanks,preprocessing
宜都市是地處中華人民共和國湖北省西南部的一個縣級市，隸屬地級宜昌市管轄，位於長江南岸，長江與其支流清江交匯處。,zh,Chinese,Universal Dependencies Treebanks,preprocessing
宜都市處於鄂西山地和江漢平原過渡地帶，地勢西南高、東北低，由西南向東北傾斜，是一個丘陵起伏的半山區。,zh,Chinese,Universal Dependencies Treebanks,preprocessing
2012年3月15日，徐明遭到了中紀委調查，大連實德集團表示徐明已失去聯絡半個月。,zh,Chinese,Universal Dependencies Treebanks,preprocessing
實德集團是大連市的一家民營企業，成立於1992年。,zh,Chinese,Universal Dependencies Treebanks,preprocessing
總部位於大連市西崗區高爾基路38號。,zh,Chinese,Universal Dependencies Treebanks,preprocessing
在戲劇上，審美距離指觀眾不應混淆舞台表演與現實世界的距離。,zh,Chinese,Universal Dependencies Treebanks,preprocessing
審美距離的存在並不排除觀眾方面出現某種「對號入座」的現象。,zh,Chinese,Universal Dependencies Treebanks,preprocessing
主要職責是管理宮廷的修繕、食事、掃除、醫療等事庶務，以及天皇財産的管理。,zh,Chinese,Universal Dependencies Treebanks,preprocessing
10日上午在陸軍省的會議中，青年軍官們要求阿南惟幾辭職，從而逼迫內閣總辭職，以達到阻止無條件投降的目的。,zh,Chinese,Universal Dependencies Treebanks,preprocessing
另一方面，畑中等人也試圖做近衛師團的工作。,zh,Chinese,Universal Dependencies Treebanks,preprocessing
天皇隨即表示贊同外相東鄉的主張，會議遂做出了接受波茨坦宣言的決定。,zh,Chinese,Universal Dependencies Treebanks,preprocessing
宮城因為自負的性格，曾經與三井壽有過一段私人恩怨。,zh,Chinese,Universal Dependencies Treebanks,preprocessing
1912年，宮崎滔天參加了孫文就任臨時大總統的儀式。,zh,Chinese,Universal Dependencies Treebanks,preprocessing
吉本本想召集沼田一家進行家訪，然而關鍵人物茂之卻不肯露面，面對如此學生，吉本作出了驚人之舉。,zh,Chinese,Universal Dependencies Treebanks,preprocessing
安仁屋政昭以長達20多年對當地居民的採訪經驗為依據，其證言表明無論是屠殺居民還是集體自殺的責任都在日本軍方，對於居民的犧牲，軍方總指揮官曾有過計劃（命令），另外即使沒有命令，各級官兵都自發作出了上述行為。,zh,Chinese,Universal Dependencies Treebanks,preprocessing
家用伺服器通常都會扮演網路儲存設備的角色，為所有使用者提供安全的檔案儲存服務，而且擁有存取控制管理。,zh,Chinese,Universal Dependencies Treebanks,preprocessing
酪梨醣是利用高科技分子蒸餾法由天然酪梨中萃取。,zh,Chinese,Universal Dependencies Treebanks,preprocessing
寬吻海豚可以同其他種類的海豚交配，在自然界和圈養狀態下都有這種情況發生。,zh,Chinese,Universal Dependencies Treebanks,preprocessing
宵禁就是管理員下班（0:00 AM）到次日上班之前（9:00 AM）禁止發帖和回復，該規則在2010上海世博會期間實行，導致大量海外網友由於時差緣故無法正常發帖。,zh,Chinese,Universal Dependencies Treebanks,preprocessing
分布於西達印度洋塞席爾群島及馬爾地夫群島以及海南省中沙群島等，屬於熱帶淺海底層魚。,zh,Chinese,Universal Dependencies Treebanks,preprocessing
這兩句話的意思分別和前述兩句話意義相同。,zh,Chinese,Universal Dependencies Treebanks,preprocessing
密室推理（Locked room mystery，或稱密室殺人）是推理小說常見的一種類型。,zh,Chinese,Universal Dependencies Treebanks,preprocessing
"これに不快感を示す住民はいましたが,現在,表立って反対や抗議の声を挙げている住民はいないようです。",ja,Japanese,Universal Dependencies Treebanks,preprocessing
"幸福の科学側からは,特にどうしてほしいという要望はいただいていません。",ja,Japanese,Universal Dependencies Treebanks,preprocessing
"星取り参加は当然とされ,不参加は白眼視される。",ja,Japanese,Universal Dependencies Treebanks,preprocessing
室長の対応には終始誠実さが感じられた。,ja,Japanese,Universal Dependencies Treebanks,preprocessing
多くの女性が生理のことで悩んでいます。,ja,Japanese,Universal Dependencies Treebanks,preprocessing
先生の理想は限りなく高い。,ja,Japanese,Universal Dependencies Treebanks,preprocessing
"それは兎も角,私も明日の社説を楽しみにしております。",ja,Japanese,Universal Dependencies Treebanks,preprocessing
"そうだったらいいなあとは思いますが,日本学術会議の会長談話について“当会では,標記の件について,以下のように考えます。”",ja,Japanese,Universal Dependencies Treebanks,preprocessing
教団にとっては存続が厳しくなると思う。,ja,Japanese,Universal Dependencies Treebanks,preprocessing
しかし強制していなくても問題です,ja,Japanese,Universal Dependencies Treebanks,preprocessing
"民族派のみなさんにとって陛下はいちばん大切な方ですから,その霊言について“あり得ない”という前提でお話をされる。",ja,Japanese,Universal Dependencies Treebanks,preprocessing
新しい産業構造を作らなければいけない。,ja,Japanese,Universal Dependencies Treebanks,preprocessing
心がないんだ。,ja,Japanese,Universal Dependencies Treebanks,preprocessing
そのモサは今何をしているか。,ja,Japanese,Universal Dependencies Treebanks,preprocessing
本音としてはこの火に油を注ぎたいけれど。,ja,Japanese,Universal Dependencies Treebanks,preprocessing
25日も楽しみにされてください。,ja,Japanese,Universal Dependencies Treebanks,preprocessing
"なんだよなんだよぉ~,わが署に来たのなら教えてくれよぉ~。",ja,Japanese,Universal Dependencies Treebanks,preprocessing
"どの本もツッコミどころが山ほどあり,会場内が爆笑の連続でした。",ja,Japanese,Universal Dependencies Treebanks,preprocessing
"社会への恨みと,破滅させたいという恐ろしいほどの煩悩。",ja,Japanese,Universal Dependencies Treebanks,preprocessing
とんでもない。,ja,Japanese,Universal Dependencies Treebanks,preprocessing
"抗議デモの継続を宣言した統一教会,日本でも韓国東亜日報の様に襲撃事件が起こる惧れはないのか?",ja,Japanese,Universal Dependencies Treebanks,preprocessing
"ついつい言葉だけで机上の空論をこねがちな自分は,ここは激しく自戒ですね...",ja,Japanese,Universal Dependencies Treebanks,preprocessing
"当選して市長になってもなお,摂理との関係を明らかにしようとしないのは,とても残念。",ja,Japanese,Universal Dependencies Treebanks,preprocessing
この夏が実は最大の山場になります。,ja,Japanese,Universal Dependencies Treebanks,preprocessing
"政府がもっと宗教法人の定義を厳しくし,こういう団体は排除すべき。",ja,Japanese,Universal Dependencies Treebanks,preprocessing
"まあ,それが親心だ。",ja,Japanese,Universal Dependencies Treebanks,preprocessing
"大川隆法氏を支持する人が挙げた主な理由は,以下のとおり。",ja,Japanese,Universal Dependencies Treebanks,preprocessing
すごくそういうところを引っかかる感じですか?,ja,Japanese,Universal Dependencies Treebanks,preprocessing
この記事が本当ならいくつかの問題がはっきり見えてきます。,ja,Japanese,Universal Dependencies Treebanks,preprocessing
"今,何もそれは達成されていない。",ja,Japanese,Universal Dependencies Treebanks,preprocessing
身勝手すぎる。,ja,Japanese,Universal Dependencies Treebanks,preprocessing
"大人と子供では体質が違うので,“大人に良いものが子供にもいい”とは必ずしもいえません。",ja,Japanese,Universal Dependencies Treebanks,preprocessing
愛人がいたら怒るでしょ。,ja,Japanese,Universal Dependencies Treebanks,preprocessing
"キリスト教世界でも,たとえばアメリカでは大統領は宣誓式で聖書に手を置くし,共和党の選挙運動ではキリスト教会が力を持っている。",ja,Japanese,Universal Dependencies Treebanks,preprocessing
"“カンボジア三百万人大量虐殺をほめたたえ,カンパ集める”",ja,Japanese,Universal Dependencies Treebanks,preprocessing
"奇しくも,今年1月付けの最新号です。",ja,Japanese,Universal Dependencies Treebanks,preprocessing
一番の方法は煎じることです。,ja,Japanese,Universal Dependencies Treebanks,preprocessing
"それでも,くり返しくり返し,人民に侵略反対を訴え続けて十年がたった。",ja,Japanese,Universal Dependencies Treebanks,preprocessing
"説教というか,アジテーションが始まります。",ja,Japanese,Universal Dependencies Treebanks,preprocessing
"参考文献リストを見る限りでは,本を書くにあたって読んだのかはわからないが,広範囲に亘って本を読んでいて勉強していることはわかった。",ja,Japanese,Universal Dependencies Treebanks,preprocessing
"文殊菩薩私が幸福になっていない以上,世界伝道などはありえない!",ja,Japanese,Universal Dependencies Treebanks,preprocessing
しばらくの完全休養とリハビリが必要とのことでした。,ja,Japanese,Universal Dependencies Treebanks,preprocessing
"いまのところ,訴訟沙汰になったとか,米・中・朝の軍が幸福の科学を襲撃したといった話は聞きません。",ja,Japanese,Universal Dependencies Treebanks,preprocessing
バームクーヘンでも周りにお砂糖がたっぷり付いているもの。,ja,Japanese,Universal Dependencies Treebanks,preprocessing
"しかし,心配には及ばないようです。",ja,Japanese,Universal Dependencies Treebanks,preprocessing
"いったい,“次世紀ファーム研究所”とは何なのか。",ja,Japanese,Universal Dependencies Treebanks,preprocessing
"その後,一部の会員に渡すための賞状にサインしてくださいと頼まれ,サインをいたしました。",ja,Japanese,Universal Dependencies Treebanks,preprocessing
"事前に海老澤代表からは“40歳くらいとお若いけれど,とても家系のことに詳しい先生”と聞かされていた。",ja,Japanese,Universal Dependencies Treebanks,preprocessing
“1000万円当たりますように”というのもありました。,ja,Japanese,Universal Dependencies Treebanks,preprocessing
"いつもどおりなので,たぶん何も問題ありません。",ja,Japanese,Universal Dependencies Treebanks,preprocessing
震災に乗じて末端信者から献金を集めようとの意図が判る。,ja,Japanese,Universal Dependencies Treebanks,preprocessing
"Ad Plannerもサイトの月間利用者の推定データだと思うので,Twitterアカウント数でも,Twitter利用者数でもないだろう。",ja,Japanese,Universal Dependencies Treebanks,preprocessing
"“天聖稲荷大権現神社”を出て,“箱根大天狗山神社”へ向かう。",ja,Japanese,Universal Dependencies Treebanks,preprocessing
みんな自分の立場から主張しています。,ja,Japanese,Universal Dependencies Treebanks,preprocessing
"“鶴”は統一教会教祖・文鮮明の妻,韓鶴子が由来か。",ja,Japanese,Universal Dependencies Treebanks,preprocessing
“心筋梗塞になったが神様に命を救っていただいた”,ja,Japanese,Universal Dependencies Treebanks,preprocessing
広告審査部への取り次ぎは読者センターの判断に委ねるとのこと。,ja,Japanese,Universal Dependencies Treebanks,preprocessing
ビデオセンタースタッフも参加。,ja,Japanese,Universal Dependencies Treebanks,preprocessing
"空気を読もうとする姿勢が見られ,不思議な気持ちになりました。",ja,Japanese,Universal Dependencies Treebanks,preprocessing
"だが,生真面目な彼は少し困った顔をしてこう言った。",ja,Japanese,Universal Dependencies Treebanks,preprocessing
どうぞ取材に来てください。,ja,Japanese,Universal Dependencies Treebanks,preprocessing
"でも党が結成されたときは,けっこう報道されていましたよ。",ja,Japanese,Universal Dependencies Treebanks,preprocessing
陳述書に“現在も通っている”と書いてあるが?,ja,Japanese,Universal Dependencies Treebanks,preprocessing
"ファンの皆様には混乱を招いてしまい,誠に申し訳ございません。",ja,Japanese,Universal Dependencies Treebanks,preprocessing
"教祖の浮気性,あくなき欲望。",ja,Japanese,Universal Dependencies Treebanks,preprocessing
さっぱり意味がわかりません。,ja,Japanese,Universal Dependencies Treebanks,preprocessing
心よりお悔やみ申し上げます。,ja,Japanese,Universal Dependencies Treebanks,preprocessing
"そんな俗世の快楽を楽しむ彼も,インタビューには“洗礼を受けるつもり”と答えている。",ja,Japanese,Universal Dependencies Treebanks,preprocessing
"記者はその勝手な言い分に対し,“暑い中,わざわざ来てくれた警官に失礼だろう!”",ja,Japanese,Universal Dependencies Treebanks,preprocessing
"というか,返す刀で互いを批判し合っています。",ja,Japanese,Universal Dependencies Treebanks,preprocessing
"みな,事実に基づいて恐怖と憎悪と嘲りを込めてぼくをカルトくんと呼んでくれています。",ja,Japanese,Universal Dependencies Treebanks,preprocessing
そうだろ?,ja,Japanese,Universal Dependencies Treebanks,preprocessing
すごいすごい。,ja,Japanese,Universal Dependencies Treebanks,preprocessing
"もちろん,まじめにやっている宗教法人もあるとは思いますが,やりたい放題やろうと思えばできてしまう構造は変える必要があるように思います。",ja,Japanese,Universal Dependencies Treebanks,preprocessing
"きっと,地上天国の中にいるのでしょう。",ja,Japanese,Universal Dependencies Treebanks,preprocessing
過去に自らが主催した飯田氏の講演の映像もYou Tubeから削除しました。,ja,Japanese,Universal Dependencies Treebanks,preprocessing
"もう一つびっくりしたことと言えば,公立学校の中には保育所が併設されているところがあるということです。",ja,Japanese,Universal Dependencies Treebanks,preprocessing
"おかしな販売をしているといっても,それはあくまでも刑事事件の話であって,公安部が出てくる筋ではありません。",ja,Japanese,Universal Dependencies Treebanks,preprocessing
"地方に住む知人の僧侶によると,こんな話もありました。",ja,Japanese,Universal Dependencies Treebanks,preprocessing
"だからまあ,もう,“殺ってくれ”とは言っておいたから。",ja,Japanese,Universal Dependencies Treebanks,preprocessing
"右奥に見える重機が,我々に何かを物語っている気がしないでもありません。",ja,Japanese,Universal Dependencies Treebanks,preprocessing
とても賢い生徒さんです。,ja,Japanese,Universal Dependencies Treebanks,preprocessing
"たまたま,お互いに潜入取材の最中だった。",ja,Japanese,Universal Dependencies Treebanks,preprocessing
"ホメオパシーのレメディは毒にも薬にもならない“ただの水”と砂糖玉なので,司法解剖によってわかる類の因果関係なんてあるはずもありません。",ja,Japanese,Universal Dependencies Treebanks,preprocessing
"まさか松田氏は,男性が倒れる前から消防に通報していたとでもいうつもりだったのでしょうか。",ja,Japanese,Universal Dependencies Treebanks,preprocessing
是非書けるようになってみたい。,ja,Japanese,Universal Dependencies Treebanks,preprocessing
どう見ても幸福の科学出版の広告です。,ja,Japanese,Universal Dependencies Treebanks,preprocessing
"おおつた氏は数年前に勧誘され足立教会の通教組織である【びぎん】に所属,前線での違法な勧誘や霊感商法には関わっていなかったらしい。",ja,Japanese,Universal Dependencies Treebanks,preprocessing
"昔,阪神淡路大震災の時は,駅から重いリックを背負って,片道3時間歩いて仮設トイレ等の設置のボランティアに行きましたが,被災地の大変さは,想像以上でした。",ja,Japanese,Universal Dependencies Treebanks,preprocessing
"かなりの長文になりますが,どうかご了解をお願いします。",ja,Japanese,Universal Dependencies Treebanks,preprocessing
"政党と柴犬を同列に扱うというのも,なかなかです。",ja,Japanese,Universal Dependencies Treebanks,preprocessing
"ですから,もろもろ客観的解説やツッコミも入ります。",ja,Japanese,Universal Dependencies Treebanks,preprocessing
"その後一行は,池袋駅に移動。",ja,Japanese,Universal Dependencies Treebanks,preprocessing
"学校法人幸福の科学学園が2013年に関西校を開校するため土地を購入した滋賀県大津市内で,学園開校に反対する声が地元住民から挙がっています。",ja,Japanese,Universal Dependencies Treebanks,preprocessing
"では,同じくメディアとしての品性のかけらもない“やや日刊カルト新聞”が,品性のかけらもない宗教者たちの過去のエロ事件を調べてみました。",ja,Japanese,Universal Dependencies Treebanks,preprocessing
宗教は怖い?,ja,Japanese,Universal Dependencies Treebanks,preprocessing
"また渡辺弁護士は,こうも指摘します。",ja,Japanese,Universal Dependencies Treebanks,preprocessing
その流れというのもあるので???。,ja,Japanese,Universal Dependencies Treebanks,preprocessing
勝利の女神がどちらにほほ笑むか全く分からない展開。,ja,Japanese,Universal Dependencies Treebanks,preprocessing
ストイコビッチ監督は「浦和は最後まで目を覚ますことがなかった」と、ジョークを交えながら「柏さんにはおめでとうと言いたい」と新王者を称えた。,ja,Japanese,Universal Dependencies Treebanks,preprocessing
一団の脇をレスキューボードでライフセーバーが泳ぎ、さらにカヌー、水上バイクもその外に待機する。,ja,Japanese,Universal Dependencies Treebanks,preprocessing
...あなたが涙を流した「SATC」のエピソードは?,ja,Japanese,Universal Dependencies Treebanks,preprocessing
ジャンボ機の愛称で知られるボーイング747のうち、約20年にわたって日航で活躍してきた国内線仕様の「400D型」の引退フライトツアーが19日あり、参加した約450人が乗り込み別れを惜しんだ。,ja,Japanese,Universal Dependencies Treebanks,preprocessing
センター街の片隅で、撮影の準備を始める大島優子さんとスタッフ。,ja,Japanese,Universal Dependencies Treebanks,preprocessing
この背景には、アメリカの金融緩和の影響で多額の資金が原油の先物市場に流れ込んでいることや、新興国の需要の拡大で国際的な原油取引の価格が上昇していることがあります。,ja,Japanese,Universal Dependencies Treebanks,preprocessing
本格的だし、絶対に効くと思うので、いろいろな人に覚えてもらいたいです。,ja,Japanese,Universal Dependencies Treebanks,preprocessing
仮設を出た後に住みたい場所では、岩手、宮城の約6割が「以前住んでいた場所に近い高台」「同じ市町村」、福島の7割が「以前住んでいた場所」と答えた。,ja,Japanese,Universal Dependencies Treebanks,preprocessing
当初、アメリカ映画として作る発想から始まったので英語映画にしたが、舞台にニューヨークを選ばなかったのは、東京を壊すべきだと思ったから。,ja,Japanese,Universal Dependencies Treebanks,preprocessing
このページに掲載されている記事・写真・図表などの無断転載を禁じます。,ja,Japanese,Universal Dependencies Treebanks,preprocessing
記者がアジアを飛び回っているせいか、やはりアジアの方が多いです。,ja,Japanese,Universal Dependencies Treebanks,preprocessing
警視庁は今後、役員らから事情を聴くなど、検査妨害の全容を解明する方針。,ja,Japanese,Universal Dependencies Treebanks,preprocessing
70年ぶりに生息が確認されたクニマスの保護に向け、西湖で地元の漁業協同組合が、禁漁区を自主的に設定しました。,ja,Japanese,Universal Dependencies Treebanks,preprocessing
谷川容疑者は政治団体の構成員を名乗っていて、当時、団体の車両が中国に対する批判を繰り返す街宣活動を行っていたという。,ja,Japanese,Universal Dependencies Treebanks,preprocessing
やがて、書きためた曲を携え、「ウクレレわらべうた」として児童館などでライブを始め、そこで出会った絵本の読み聞かせをする父親たちのグループ「パパ’S絵本プロジェクト」の活動に合流。,ja,Japanese,Universal Dependencies Treebanks,preprocessing
昨年4月、オバマ米大統領が「核兵器のない世界を目指す」と訴えたプラハ演説以降、潮目が変わってきているのかなと、かすかな期待を抱く。,ja,Japanese,Universal Dependencies Treebanks,preprocessing
だが08年4月、あごを骨折し3つ目の王座から陥落。,ja,Japanese,Universal Dependencies Treebanks,preprocessing
今期の経常利益は急回復する見通しだが、中期的に見れば、震災の影響はジワジワ効いてくる。,ja,Japanese,Universal Dependencies Treebanks,preprocessing
鋭い眼光でこちらを睨み付けるニノ、ヴィジュアル系のように自分を抱きしめるニノ、壁にへばり付き何かに怯えるニノ......。,ja,Japanese,Universal Dependencies Treebanks,preprocessing
パク・チウォン代表は「25人の将軍級を懲戒するというが、こうした重大な問題を監査院の監査で懲戒程度で終わらせることはありえない」、「軍法会議に回付して、軍検察が徹底した調査をするように要求する」と述べた。,ja,Japanese,Universal Dependencies Treebanks,preprocessing
SMBC日興証券は2012年秋をめどにシンガポール拠点を開設する。,ja,Japanese,Universal Dependencies Treebanks,preprocessing
3年ぶりにボランチでプレーしたので自己評価は出来ない。,ja,Japanese,Universal Dependencies Treebanks,preprocessing
わずか半年間に重賞を3勝し、血統馬にふさわしい活躍を見せてきた。,ja,Japanese,Universal Dependencies Treebanks,preprocessing
伏兵の一発を含む11安打9得点で静岡県勢として春通算50勝を達成。,ja,Japanese,Universal Dependencies Treebanks,preprocessing
メディアから「45年の歴史を持つメジャーリーグのドラフト史上で『最高の選手』」と言われていたストラスバーグだが、この契約金は各方面で話題になった。,ja,Japanese,Universal Dependencies Treebanks,preprocessing
