text,iso_code,language_name,source,usage
したがって、横滑り側の片翼の揚力が反対側よりも大きくなり、エルロン操作を行なわなくとも傾きは回復する。,ja,Japanese,Universal Dependencies Treebanks,preprocessing
その理由は“科学の無視”です。,ja,Japanese,Universal Dependencies Treebanks,preprocessing
艦名はエイの一種であるスケートに因む。,ja,Japanese,Universal Dependencies Treebanks,preprocessing
脱線の原因は不明で、地元の消防局は、煙に有害物質が含まれている可能性があると周辺の住民に注意を呼びかけている。,ja,Japanese,Universal Dependencies Treebanks,preprocessing
こうしたことは、後の大洪水時代においても同様であり、貴族共和制の弱点を突かれたと言える。,ja,Japanese,Universal Dependencies Treebanks,preprocessing
安徽省安慶出身。,ja,Japanese,Universal Dependencies Treebanks,preprocessing
ペリューは、1804年に少将に昇進した。,ja,Japanese,Universal Dependencies Treebanks,preprocessing
グレズリー式連動弁装置は実質上は付加装置であって、外側二気筒の弁装置の位置を逆向きに合成して中央シリンダーの弁位置を決めている。,ja,Japanese,Universal Dependencies Treebanks,preprocessing
目標が超音速飛行している場合においても、その時だけ短時間飛行できれば問題無く、長時間の超音速飛行によって追尾する必要は無いからである。,ja,Japanese,Universal Dependencies Treebanks,preprocessing
新快速の運行時間外などは快速としても運用され、稀に湘南色との混色編成などもあった。,ja,Japanese,Universal Dependencies Treebanks,preprocessing
13歳の頃から数々の舞台に出演しており、アル・パチーノとの共演歴もある。,ja,Japanese,Universal Dependencies Treebanks,preprocessing
当初、民主党の西村智奈美が「審議に100時間は必要だ」と主張し、与党側も「重要法案」指定を見送ったことから、第171回国会での公文書管理法の成立は絶望視されていた。,ja,Japanese,Universal Dependencies Treebanks,preprocessing
神奈川県鎌倉市北鎌倉出身。,ja,Japanese,Universal Dependencies Treebanks,preprocessing
唯一、最初から冥術を使用できるクラス。,ja,Japanese,Universal Dependencies Treebanks,preprocessing
1883年に家族に連れられてドイツに移住。,ja,Japanese,Universal Dependencies Treebanks,preprocessing
味は申し分ない。,ja,Japanese,Universal Dependencies Treebanks,preprocessing
そして5月にリリースした「Story」は8位初登場の後、売上枚数30万枚、ダウンロード件数400万件となり、同曲で初のNHK紅白歌合戦出場を果す。,ja,Japanese,Universal Dependencies Treebanks,preprocessing
詳細は槍槓を参照。,ja,Japanese,Universal Dependencies Treebanks,preprocessing
プードルの女の子のキャラクター。,ja,Japanese,Universal Dependencies Treebanks,preprocessing
僕ができるのはクルマのフィードバックだけ。,ja,Japanese,Universal Dependencies Treebanks,preprocessing
バスは園児19人と運転手、幼稚園の職員の計21人が乗車し、幼稚園に向かう途中だった。,ja,Japanese,Universal Dependencies Treebanks,preprocessing
一般的にハニー・ライトニング・フレアより威力が高い。,ja,Japanese,Universal Dependencies Treebanks,preprocessing
この地形を利用している生物がアキアカネである。,ja,Japanese,Universal Dependencies Treebanks,preprocessing
14日未明、ジャーヴィスはスペイン艦隊が風上35マイルにあることを知った。,ja,Japanese,Universal Dependencies Treebanks,preprocessing
考え方の源流は、アルキメデスが円周率の近似値を計算する際に用いた方法にまで遡るが、現代的な形での定式化はガウスによってなされた。,ja,Japanese,Universal Dependencies Treebanks,preprocessing
非常に楽しみです。,ja,Japanese,Universal Dependencies Treebanks,preprocessing
MVPは打率.450、2本塁打、6打点の成績をあげたアラン・トランメルが初選出。,ja,Japanese,Universal Dependencies Treebanks,preprocessing
ラジカルは反応性が高く、生物学的環境ではたいていの場合あまり高濃度では存在せず、ラジカルに1電子を奪われた分子が他の分子から電子を引き抜くとその分子がさらにラジカルを形成するので反応は連鎖的に進行する。,ja,Japanese,Universal Dependencies Treebanks,preprocessing
会社の業務もナイフや刀剣の売買が主体となるが、いずれの名称も同好会的な誤解を生じ易いため、そうした誤解を上手く利用して業績を上げたようである。,ja,Japanese,Universal Dependencies Treebanks,preprocessing
これは、学校教育や大手新聞やテレビや書籍で、「日本は韓国の優れた文化を受け入れるだけの文化劣等国」「有史以来一枚見下げるべき文化的劣等者」「韓半島に比べてみすぼらしくて短い歴史しか持たず、歴史を捏造するしかない日本」というような対日蔑視に基づいた誤った論評が日常的に行われたり、日本列島を指す「島国」という言葉が「劣等で未開」という意味で使われて、駐日韓国大使がテレビのインタビューで使うまでになっていることからも伺える。,ja,Japanese,Universal Dependencies Treebanks,preprocessing
同校は1923年に創立された、ヒューストンでは最も長い歴史を誇る法学校で、模擬裁判プログラムがつとに良く知られている。,ja,Japanese,Universal Dependencies Treebanks,preprocessing
横須賀線への転属後、主電動機を強力形に交換した7両が新形式のモハ53形を付与された。,ja,Japanese,Universal Dependencies Treebanks,preprocessing
変更点の詳細については、タイムクライシス4の項を参照のこと。,ja,Japanese,Universal Dependencies Treebanks,preprocessing
一部で9月中間期の連結営業利益が36億円前後と前年同期比35%程度増えたようだと伝えられたことが買い材料となった。,ja,Japanese,Universal Dependencies Treebanks,preprocessing
便宜的に分類したがもちろん複数のケースにまたがった適応を示す動物も多い。,ja,Japanese,Universal Dependencies Treebanks,preprocessing
12月2日の午後、ドイツ空軍パイロット、ヴェルナー・ハーンはMe210でバーリを上空から偵察した。,ja,Japanese,Universal Dependencies Treebanks,preprocessing
暴騰する食料価格や大災害で人心は荒廃し、食料目当ての暴動や若者の退廃が進行。,ja,Japanese,Universal Dependencies Treebanks,preprocessing
幸福の科学学園の毎時4.20マイクロシーベルトというこの基準を上回ります。,ja,Japanese,Universal Dependencies Treebanks,preprocessing
長時間拘束され半軟禁状態の女性もいた。,ja,Japanese,Universal Dependencies Treebanks,preprocessing
同発電所は老朽化した小規模の発電所で、警備は手薄だった。,ja,Japanese,Universal Dependencies Treebanks,preprocessing
回転ジェットによる体当たり攻撃。,ja,Japanese,Universal Dependencies Treebanks,preprocessing
屋根のアンテナにカラスが止まっていたずらをするし、屋根が汚れてこまるからと、調査の依頼がありました。,ja,Japanese,Universal Dependencies Treebanks,preprocessing
"そのカステラは,表面に“祝3.16広宣流布記念の日”と印字されており,これを買うと,創価学会のシンボルである3色デザインの紙袋に入れてくれます。",ja,Japanese,Universal Dependencies Treebanks,preprocessing
13世紀の建築は1456年から1466年にかけて新しいサンクチュアリに合うように改築された。,ja,Japanese,Universal Dependencies Treebanks,preprocessing
インクは、大きく分けてビン入りとカートリッジ入りの2種類の形態で流通している。,ja,Japanese,Universal Dependencies Treebanks,preprocessing
勧誘員と勧誘対象者。,ja,Japanese,Universal Dependencies Treebanks,preprocessing
また、攻撃手法としてはJava Scriptの難読化による手口や、PDFを利用した攻撃が引き続き増加しており、フィッシング詐欺の発生件数は2009年のピーク時に比べて82%減少したが、依然として金融機関が主要ターゲットとして脅威に晒されているとしている。,ja,Japanese,Universal Dependencies Treebanks,preprocessing
"これがまた,うまい。",ja,Japanese,Universal Dependencies Treebanks,preprocessing
艦長は、爆薬をリモコンによる遠隔操作で爆発させて艦内の機材や機密文書等を爆破処分し、証拠を隠滅しようとしたが、効果は不十分に終わった。,ja,Japanese,Universal Dependencies Treebanks,preprocessing
アイドルユニットとしても売り出され、フリーランスになってからは主演Vシネマの主題歌CDもだし、歌手デビューも果たす。,ja,Japanese,Universal Dependencies Treebanks,preprocessing
毛布にくるまって寒さをしのぎ、おにぎり1個を家族4人で分け合った。,ja,Japanese,Universal Dependencies Treebanks,preprocessing
動きは緩慢だが常にスーパーアーマー状態であり、ほとんどの攻撃を受けてもひるまない。,ja,Japanese,Universal Dependencies Treebanks,preprocessing
よく見ると、背中や腹にあるぶち模様がいずれもハートの形をしており「体全体にハートがある猫」と口コミで広がったという。,ja,Japanese,Universal Dependencies Treebanks,preprocessing
"タダで留学生が韓国料理をふるまい,韓国語も教えるので,日本語を教えてもらったり,友達になってもらいたい。",ja,Japanese,Universal Dependencies Treebanks,preprocessing
「VANITY DANCE」と「Labyrinth」は、オムニバスアルバム『漆黒のシンフォニー』に収録されたもののリミックスバージョンである。,ja,Japanese,Universal Dependencies Treebanks,preprocessing
そのうちの幾つかはイギリス当局がケニア人を抑圧した方法をそのまま転用したものだった。,ja,Japanese,Universal Dependencies Treebanks,preprocessing
縦に並ぶ4門の砲台から、それぞれバウンド弾、ブーメラン弾、誘導弾、レーザーを発射する。,ja,Japanese,Universal Dependencies Treebanks,preprocessing
木炭デッサンにおいて消しゴムは硬くて紙を傷めるために使用できず、柔らかく油分の少ない食パンを代用している。,ja,Japanese,Universal Dependencies Treebanks,preprocessing
"大変,卑怯といわざるをえない。",ja,Japanese,Universal Dependencies Treebanks,preprocessing
いろんなメニューがあり、どんどん頼みたくなっちゃいますね!,ja,Japanese,Universal Dependencies Treebanks,preprocessing
"この手の本が翻訳されることは少ないと思っていたのだが,昨今のソーシャル流行りが要因かはわからないが,翻訳本が原書から1年もしないでリリースされたのはよい知らせだ。",ja,Japanese,Universal Dependencies Treebanks,preprocessing
「1997〜1999」とは、FBIがデビューした年から本作が発売された年を意味する。,ja,Japanese,Universal Dependencies Treebanks,preprocessing
生きていくことは美しいことだといつも思う。,ja,Japanese,Universal Dependencies Treebanks,preprocessing
ドラゴンズは9番チェンからの打順だったが、代打に水田を送る。,ja,Japanese,Universal Dependencies Treebanks,preprocessing
ダウンタウンの17ブロックにわたって広がるシアター・ディストリクトには9つの著名な演技芸術団体が本部を置き、6ヶ所のホールが立地している。,ja,Japanese,Universal Dependencies Treebanks,preprocessing
昔ながらの「売りっぱなし」商売をしている。,ja,Japanese,Universal Dependencies Treebanks,preprocessing
中学ではシェークスピア・ギリシア哲学・演劇にも熱中した。,ja,Japanese,Universal Dependencies Treebanks,preprocessing
後の稲川組幹部)と知り合い、出口辰夫と兄弟分となった。,ja,Japanese,Universal Dependencies Treebanks,preprocessing
会議後は資料作成などに着手し、退社は夜12時前後。,ja,Japanese,Universal Dependencies Treebanks,preprocessing
現在の計画停電の3時間であれば、つけっぱなしにしても大丈夫そうだ。,ja,Japanese,Universal Dependencies Treebanks,preprocessing
"皮肉なことに信濃町は,共産党タウン以上に北朝鮮的な街なのである。",ja,Japanese,Universal Dependencies Treebanks,preprocessing
一般的に、貧栄養な外洋では生物過程による全エネルギー・炭素フラックスに占める微生物環の割合が沿岸や内湾よりも高い。,ja,Japanese,Universal Dependencies Treebanks,preprocessing
ストリンガー氏は震災発生時は米国におり、被災現場を訪れたのは初めて。,ja,Japanese,Universal Dependencies Treebanks,preprocessing
ジョージ・ハリスンの作品。,ja,Japanese,Universal Dependencies Treebanks,preprocessing
前作では10枚以上コインを取るとスーパーキノコが出てきたが、本作ではコインが5枚散らばるようになっている。,ja,Japanese,Universal Dependencies Treebanks,preprocessing
籾井王子から紀州街道旧道を西に1.5kmほど進み、海営宮池という池の近くの交差点を北に向かう脇道に入ったところに墓地があり、その北側に石碑と説明板がある。,ja,Japanese,Universal Dependencies Treebanks,preprocessing
2006年11月8日、関東地方から東北地方にかけてカリオペとリヌスによる恒星の掩蔽がアマチュア天文家たちによって観測され、カリオペとリヌスの正確な大きさと位置が求められた。,ja,Japanese,Universal Dependencies Treebanks,preprocessing
一方、東海地方北陸地方以東の東日本は、比較的広い沖積平野に恵まれていた上に、太平洋側を中心に低開発状態の洪積台地や河岸段丘面の農地開発の余地が大きく、日本海側を中心に扇状地でも開発の余地が広く存在したため、江戸時代に至っても、急峻な山地の傾斜面を切り開いて棚田をつくるまでに至らなかったところが多く、棚田はあまりつくられないか、つくられた場合でも畔や土手は傾斜が緩やかな土盛りとなり、西日本とは対照的な棚田風景となった。,ja,Japanese,Universal Dependencies Treebanks,preprocessing
帰り道、あまり気持ちよかったのでフワフワしちゃいましたよ。,ja,Japanese,Universal Dependencies Treebanks,preprocessing
当駅の所在する地名より。,ja,Japanese,Universal Dependencies Treebanks,preprocessing
右腕からチャージショットを放つ「ハイパーZEROブラスター」は火力が高く、空中でのけん制にも使えるなどゼロにとって重要な技となる。,ja,Japanese,Universal Dependencies Treebanks,preprocessing
本当に焼いただけでいただけるというところが気に入っています。,ja,Japanese,Universal Dependencies Treebanks,preprocessing
安くて早いから、この系列店をよく使わせてもらっているが、ここはカットが下手過ぎる。,ja,Japanese,Universal Dependencies Treebanks,preprocessing
また利用したいです。,ja,Japanese,Universal Dependencies Treebanks,preprocessing
"天理教は,新宿区高田馬場にある牛込大教会を開放。",ja,Japanese,Universal Dependencies Treebanks,preprocessing
"馬鹿な事を続けていれば信者からの求心力がどんどん失われていくでしょうから,そのままカルト崩壊へGO!",ja,Japanese,Universal Dependencies Treebanks,preprocessing
生理的に嫌。,ja,Japanese,Universal Dependencies Treebanks,preprocessing
言い回しや態度が妙に芝居がかっており、プレイヤーからは「キモイ」と言われていた。,ja,Japanese,Universal Dependencies Treebanks,preprocessing
十メートル長の巨大なライフルと、周囲の景色に同化する機能を持つマントを駆使するスナイパー。,ja,Japanese,Universal Dependencies Treebanks,preprocessing
猫が亡くなった今でも心から感謝しています。,ja,Japanese,Universal Dependencies Treebanks,preprocessing
"2008年1月から6月に振り込め詐欺・オレオレ詐欺で使用された携帯電話約2,300台のうち約7割がソフトバンク携帯だったとの報道が12月にあった。",ja,Japanese,Universal Dependencies Treebanks,preprocessing
これにより業務協力で会員社の経営の効率化を図った。,ja,Japanese,Universal Dependencies Treebanks,preprocessing
水牛のような角を持つ漆黒の巨人の姿をしており、目から放つ光線であらゆる物を砂に変えて崩壊させる。,ja,Japanese,Universal Dependencies Treebanks,preprocessing
ただし、書いていないのか未採択なのかの区別をつけるために「研究」節内で「*私立大学学術研究高度化推進事業の採択はない。,ja,Japanese,Universal Dependencies Treebanks,preprocessing
"男は女の為に闘い抜いたとき女は心を寄せるのであって,何もしないで足の長さで女を釣ろうとするのはルンペンのやることである。",ja,Japanese,Universal Dependencies Treebanks,preprocessing
後続の車両の方がBAの番号は若いが、BA-27の27は開発年度から来ているものと以降の車両はほぼ製作順に番号が並んでいる。,ja,Japanese,Universal Dependencies Treebanks,preprocessing
"ご理解とご協力,よろしくお願いいたします。",ja,Japanese,Universal Dependencies Treebanks,preprocessing
亜大の東浜も6回で12三振を奪った。,ja,Japanese,Universal Dependencies Treebanks,preprocessing
直人の妻。,ja,Japanese,Universal Dependencies Treebanks,preprocessing
"まあAIDMA,AISASをはじめとするSIPSみたいな言葉には最近嫌悪感すらするのだけど,モデルとしては判りやすい。",ja,Japanese,Universal Dependencies Treebanks,preprocessing
2006年には柏レイソルの監督に就任。,ja,Japanese,Universal Dependencies Treebanks,preprocessing
ポッドキャスト用アグリゲータの主な目的はRSSに関連付けされているポッドキャスト・ファイルのダウンロードだが、音楽再生機能を持ち、ダウンロードしたファイルを直接再生できるものも多い。,ja,Japanese,Universal Dependencies Treebanks,preprocessing
味付けは、あっさり目で、かなり調味料に気を使っているのかもしれません。,ja,Japanese,Universal Dependencies Treebanks,preprocessing
ブラジルだけが、モーターやエンジンなど各国の先端技術を組み合わせることで、数千メートルの環境変化に耐えられる独自技術を開発した。,ja,Japanese,Universal Dependencies Treebanks,preprocessing
"こうした理由で,例えプラセボとしても,医療関係者がホメオパシーを治療に使用することは認められません。",ja,Japanese,Universal Dependencies Treebanks,preprocessing
"新聞は,助産師が所属する団体名や療法名を報じていませんが,ホメオパシーを用いる団体と思われます。",ja,Japanese,Universal Dependencies Treebanks,preprocessing
支持者によって20世紀最大の神学者と称される新正統主義のカール・バルトは、未完の主著「教会教義学」全4巻における第3巻、邦訳全36分冊中11冊分を創造説に割いている。,ja,Japanese,Universal Dependencies Treebanks,preprocessing
日産は8月6日、軽自動車「オッティ」の一部仕様を変更し、同日より発売した。,ja,Japanese,Universal Dependencies Treebanks,preprocessing
翼端に付けていた増槽は機体の重心が前に寄り過ぎるために使用されず、主翼中央下面に滑らかな形状で装着できるように再設計された。,ja,Japanese,Universal Dependencies Treebanks,preprocessing
若い頃は土司の小作人や軍の人夫をして過ごす。,ja,Japanese,Universal Dependencies Treebanks,preprocessing
クールな性格で、自らを「いやな子」と称する。,ja,Japanese,Universal Dependencies Treebanks,preprocessing
ヴァランゲル半島の北東部に位置する。,ja,Japanese,Universal Dependencies Treebanks,preprocessing
"統一教会足立教会の週報でも今回のイベントが信者に対して告知されていることから,集会の参加者にも統一教会信者が動員されるものと思われます。",ja,Japanese,Universal Dependencies Treebanks,preprocessing
第7回以降の大会で、サッカーのビクトリーゴールのように条件を満たした時点で勝ちとなる特別な勝利条件が加えられることが度々あった。,ja,Japanese,Universal Dependencies Treebanks,preprocessing
反乱軍の一人。,ja,Japanese,Universal Dependencies Treebanks,preprocessing
建築評論家。,ja,Japanese,Universal Dependencies Treebanks,preprocessing
しかし中松氏については警察関係者も苦笑い。,ja,Japanese,Universal Dependencies Treebanks,preprocessing
終盤のツール・ド・おきなわでは鳩村と共に最後まで走りぬき、30位に入る健闘を見せる。,ja,Japanese,Universal Dependencies Treebanks,preprocessing
"護符の由来どころか,そもそも杉山先生の気功能力の出自もナゾです。",ja,Japanese,Universal Dependencies Treebanks,preprocessing
見学がてらの面接後も、電話で見学してみた印象を確認してくださって後で比較検討しやすいようにとアドバイスしてくださいました。,ja,Japanese,Universal Dependencies Treebanks,preprocessing
プラスミドを改変してベクターとして利用する。,ja,Japanese,Universal Dependencies Treebanks,preprocessing
駐車場は狭いので混みあう時間帯は注意ですが、事前に電話をして到着時間を伝えておけば良いですね。,ja,Japanese,Universal Dependencies Treebanks,preprocessing
散髪のやり方次第で頭脳は発達すると考えて、どの店の散髪がよいか理髪店を絶えず替えていた。,ja,Japanese,Universal Dependencies Treebanks,preprocessing
見上げる程の大きさの弧形が地表に露出しているが、これですら全体の一部でしかなく、全体は地殻を貫通して星の核にまで達している。,ja,Japanese,Universal Dependencies Treebanks,preprocessing
また、顕彰当時現役の選手も存在したが、いずれも既に全女を退団していた。,ja,Japanese,Universal Dependencies Treebanks,preprocessing
"현대증권 배성영 수석연구원은 ""미국 통화당국의 경기부양 기조 유지 가능성과 주요20개국(G20) 정상회의를 앞둔 위안화 절상 압력의 고조로 인해 당분간 원화 강세 압력은 더 지속될 전망""이라며 ""환차익을 노린 외국인 매수세가 지속될 수 있다""고 내다봤다.",ko,Korean,Universal Dependencies Treebanks,preprocessing
씽크대 뚫는 법 비디오를 보여주시오.,ko,Korean,Universal Dependencies Treebanks,preprocessing
외대역 고수찜 닭집 누구든 가면 전혀 후회하지 않는다.,ko,Korean,Universal Dependencies Treebanks,preprocessing
위안화 절상 기대감은 중국으로 투기적 자본을 유인하는 강력한 동인이 되어 왔다.,ko,Korean,Universal Dependencies Treebanks,preprocessing
"그는 히틀러의 지배가 오래 갈 것으로 믿지 않았기 때문에, 해외망명을 거절하고 1933년~1945년까지 12년간 나치스 지배기간 중 뮌헨 외곽의 '다하우 강제 수용소'에서 8년을 포함해 10년을 감옥에서 보냈다.",ko,Korean,Universal Dependencies Treebanks,preprocessing
커피도 최고급을 사용한다고 하며 신선한 생과일 쥬스와 유기농 요거트가 일품이에요.,ko,Korean,Universal Dependencies Treebanks,preprocessing
"1989년 1월, 여의도 한강고수부지에서 대학생과 재수생 등이 경주용 모터사이클을 즐기던 중 이들이 우연히 만나게 되어 만들어진 모임이지만 1990년 6월에 여회사원과 여고생 등을 폭행한 혐의로 경찰에 구속되면서 해체되었다.",ko,Korean,Universal Dependencies Treebanks,preprocessing
가게에 메뉴가 많아서 긴가민가하고 들어갔지요.,ko,Korean,Universal Dependencies Treebanks,preprocessing
서울에 커피전문점 뭐 있나,ko,Korean,Universal Dependencies Treebanks,preprocessing
"홍춘욱 국민은행 수석연구원은 ""주요 선진국이 부채 문제로 재정 여력이 떨어졌고 통화 정책 또한 약효가 예전 같을 수는 없다""며 ""각국이 경기 침체를 탈출하기 위해 경쟁적으로 자국의 통화 가치를 떨어뜨리려 할 가능성이 높다""고 진단했다.",ko,Korean,Universal Dependencies Treebanks,preprocessing
기차로 대전 신세계 백화점 가는 길 알려줘,ko,Korean,Universal Dependencies Treebanks,preprocessing
갤럭시 S3 사진 좀 보여줘,ko,Korean,Universal Dependencies Treebanks,preprocessing
가격도 저렴하고 대체로 맛있는 집입니다,ko,Korean,Universal Dependencies Treebanks,preprocessing
